<?xml version="1.0" encoding="utf-8"?>
<!--This file is part of Chummer5a.

    Chummer5a is free software: you can redistribute it and/or modify
    it under the terms of the GNU General Public License as published by
    the Free Software Foundation, either version 3 of the License, or
    (at your option) any later version.

    Chummer5a is distributed in the hope that it will be useful,
    but WITHOUT ANY WARRANTY; without even the implied warranty of
    MERCHANTABILITY or FITNESS FOR A PARTICULAR PURPOSE.  See the
    GNU General Public License for more details.

    You should have received a copy of the GNU General Public License
    along with Chummer5a.  If not, see <http://www.gnu.org/licenses/>.

    You can obtain the full source code for Chummer5a at
    https://github.com/chummer5a/chummer5a
-->
<chummer xmlns="" xmlns:xsi="http://www.w3.org/2001/XMLSchema-instance" xsi:schemaLocation="http://www.w3.org/2001/XMLSchema books.xsd">
  <books>
    <book>
      <name>Shadowrun 5th Edition (German-exclusive Content)</name>
      <hide />
    </book>
    <book>
      <name>Street Grimoire (German-exclusive Content)</name>
      <hide />
    </book>
    <book>
      <name>Run Faster (German-exclusive Content)</name>
      <hide />
    </book>
    <book>
      <name>Schattenhandbuch (German Handbook)</name>
      <hide />
    </book>
    <book>
      <name>Schattenhandbuch 2 (German Handbook)</name>
      <hide />
    </book>
    <book>
      <name>Schattenhandbuch 3 (German Handbook)</name>
      <hide />
    </book>
    <book>
      <name>Rigger 5.0 (German-exclusive Content)</name>
      <hide />
    </book>
    <book>
      <name>State of the Art ADL (German Handbook)</name>
      <hide />
    </book>
    <book>
      <name>Hamburg (German-exclusive)</name>
      <hide />
    </book>
    <book>
      <name>Datapuls SOTA 2080 (German-exclusive)</name>
      <hide />
    </book>
    <book>
      <name>Datapuls Verschlusssache (German-exclusive)</name>
      <hide />
    </book>
  </books>
</chummer>
